Consultant(e)Finance Comptabilité/GC,2 novembre 2023,"loc:                     Tunis,                            Tunisie","['D', 'é', 't', 'a', 'i', 'l', 's', 'd', 'e', 'l', 'a', 'n', 'n', 'o', 'n', 'c', 'e', 'R', 'é', 'f', 'é', 'r', 'e', 'n', 'c', 'e', '1', '9', '0', '0', '1', '8', 'P', 'u', 'b', 'l', 'i', 'é', 'e', 'l', 'e', '2', 'n', 'o', 'v', 'e', 'm', 'b', 'r', 'e', '2', '0', '2', '3', 'T', 'y', 'p', 'e', 'd', 'e', 'p', 'o', 's', 't', 'e', 'C', 'D', 'I', 'L', 'i', 'e', 'u', 'd', 'e', 't', 'r', 'a', 'v', 'a', 'i', 'l', 'T', 'u', 'n', 'i', 's', 'T', 'u', 'n', 'i', 's', 'i', 'e', 'E', 'x', 'p', 'é', 'r', 'i', 'e', 'n', 'c', 'e', 'E', 'n', 't', 'r', 'e', '2', 'e', 't', '5', 'a', 'n', 's', 'É', 't', 'u', 'd', 'e', 'B', 'a', 'c', '5', 'D', 'i', 's', 'p', 'o', 'n', 'i', 'b', 'i', 'l', 'i', 't', 'é', 'P', 'l', 'e', 'i', 'n', 't', 'e', 'm', 'p', 's', 'L', 'a', 'n', 'g', 'u', 'e', 's', 'F', 'r', 'a', 'n', 'ç', 'a', 'i', 's', 'A', 'n', 'g', 'l', 'a', 'i', 's', 'M', 'o', 'b', 'i', 'l', 'i', 't', 'é', 'L', 'o', 'c', 'a', 'l', 'e', 'I', 'n', 't', 'e', 'r', 'n', 'a', 't', 'i', 'o', 'n', 'a', 'l']","['-Français,Anglais-']",T I M S O F T," Description de l'annonce: A propos de nous :TimsoftGroup est un one-stop-shop de la transformation digitale des entreprises.Fort de son expérience de leader des solutions de gestion,Timsoftun est éditeur, distributeur et intégrateur de solutions de gestion pour les professionnels des métiers du retail et des industries textiles et manufacturières.Fondé en 2003, Timsoft a élargi ses opérations au-delà des frontières tunisiennes avec l’ouverture de bureaux en France et au Maroc, offrant ainsi ses services dans plus de 30 pays africains, européens et du moyen orient.Timsoft, c’est aussi +120 collaborateurs dont +55 consultants et +1400 projets délivrés.Nous sommes à la recherche d’un(e)Consultant(e) Finance – Comptabilité - Gestion commerciale :Description du poste :Le / La Consultant(e) Finance – Comptabilité - Gestion commerciale assurera les tâches suivantes :Analyser les besoins, conseiller et amener le client à décider de ses choix ;Intervenir auprès de nos clients comme expert métierAccompagner les clients dans la mise en œuvre, l’adaptation et la formation à ces différents changementsParamétrer les solutions technologiques pour répondre aux besoins de nos clientsMener des projets de réorganisation en aidant nos clients à définir la stratégie de la fonction Finance ou bien en implémentant de nouveaux modèles d’organisation.Former nos clients au fonctionnement de l’ERPAccompagner nos clients dans l’évolution de leurs modèles de pilotage (indicateurs, reporting, budget, gouvernance, etc.) pour répondre à leurs enjeux stratégiquesAider à la transformation de la Fonction Finance dans le cadre d'intégration d'activités post acquisition, de scissions d'entités ou de réorganisationsstratégiques.Les exigences du profil :Les hardskills recherchés sont :BAC + 4/5, Master (Finance-Comptabilité)De formation comptabilité avec une expérience de 3 ans au moinsConnaissances des ERP (Sage, Navision, BC 365,...), idéalement CEGIDMaitrise des outils bureautiqueLes softskills recherchés sont :Vous avez des compétences avancées en ExcelVous faites preuve de rigueur, de volonté d'apprendre et de convictionsVous aimez travailler en équipe et êtes dotés d'un excellent relationnelVous êtes dynamique, entreprenant, avec un fort goût de l'analyse et un bon esprit de synthèseVous aimez innover, trouver des solutions, et relever de nouveaux défisCe que nous offrons :Salaire compétitifEnvironnement de travail propice à l’épanouissement et au développement personnelAutres avantages : Assurance groupe, tickets restos…etc                         "
Technicien en Informatique,2 novembre 2023,loc:             La Marsa,"['D', 'é', 't', 'a', 'i', 'l', 's', 'd', 'e', 'l', 'a', 'n', 'n', 'o', 'n', 'c', 'e', 'R', 'é', 'f', 'é', 'r', 'e', 'n', 'c', 'e', '1', '9', '0', '0', '4', '2', 'P', 'u', 'b', 'l', 'i', 'é', 'e', 'l', 'e', '2', 'n', 'o', 'v', 'e', 'm', 'b', 'r', 'e', '2', '0', '2', '3', 'T', 'y', 'p', 'e', 'd', 'e', 'p', 'o', 's', 't', 'e', 'C', 'D', 'I', 'C', 'D', 'D', 'L', 'i', 'e', 'u', 'd', 'e', 't', 'r', 'a', 'v', 'a', 'i', 'l', 'L', 'a', 'M', 'a', 'r', 's', 'a', 'T', 'u', 'n', 'i', 's', 'T', 'u', 'n', 'i', 's', 'i', 'e', 'E', 'x', 'p', 'é', 'r', 'i', 'e', 'n', 'c', 'e', 'E', 'n', 't', 'r', 'e', '1', 'e', 't', '2', 'a', 'n', 's', 'É', 't', 'u', 'd', 'e', 'B', 'a', 'c', '3', 'R', 'é', 'm', 'u', 'n', 'é', 'r', 'a', 't', 'i', 'o', 'n', 'p', 'r', 'o', 'p', 'o', 's', 'é', 'e', '1', '0', '0', '0', '1', '2', '0', '0', 'D', 'T', 'M', 'o', 'i', 's', 'D', 'i', 's', 'p', 'o', 'n', 'i', 'b', 'i', 'l', 'i', 't', 'é', 'P', 'l', 'e', 'i', 'n', 't', 'e', 'm', 'p', 's', 'L', 'a', 'n', 'g', 'u', 'e', 's', 'A', 'r', 'a', 'b', 'e', 'F', 'r', 'a', 'n', 'ç', 'a', 'i', 's']","['-Arabe,Français-']",A M E N   S A N T E," Description de l'annonce:  La Clinique Amen la Marsa souhaite recruter un Technicien en Informatique remplissant les critères suivants:  Formation: Technicien supérieur en informatique ou réseaux informatiques (ou similaire)  Expérience professionnelle: une expérience antérieure dans le domaine du support technique et de l’exploitation d’environnements informatiques et réseaux sera un atout  Compétences et qualités requises:  Connaissance générales des systèmes d’information, réseaux et télécoms  Connaissance générales en administration de réseaux informatiques, d’environnements et systèmes d’exploitation Windows (serveurs et clients), et des logiciels de collaboration et communication.  Respect des procédures de sécurité et de bonne utilisation des ressources informatiques  Engagement, et sens du service du client.  Capacité relationnelle.  Capacité d’adaptation.  Sens des responsabilités. - Sens de la rigueur et de l’organisation  Résistance au stress - Disponible                          "
Incident Response Analyst,2 novembre 2023,"loc:                     Tunis,                            Tunisie","['D', 'é', 't', 'a', 'i', 'l', 's', 'd', 'e', 'l', 'a', 'n', 'n', 'o', 'n', 'c', 'e', 'R', 'é', 'f', 'é', 'r', 'e', 'n', 'c', 'e', '1', '9', '0', '0', '8', '4', 'P', 'u', 'b', 'l', 'i', 'é', 'e', 'l', 'e', '2', 'n', 'o', 'v', 'e', 'm', 'b', 'r', 'e', '2', '0', '2', '3', 'T', 'y', 'p', 'e', 'd', 'e', 'p', 'o', 's', 't', 'e', 'C', 'D', 'I', 'L', 'i', 'e', 'u', 'd', 'e', 't', 'r', 'a', 'v', 'a', 'i', 'l', 'T', 'u', 'n', 'i', 's', 'T', 'u', 'n', 'i', 's', 'i', 'e', 'E', 'x', 'p', 'é', 'r', 'i', 'e', 'n', 'c', 'e', 'E', 'n', 't', 'r', 'e', '2', 'e', 't', '5', 'a', 'n', 's', 'É', 't', 'u', 'd', 'e', 'B', 'a', 'c', '5', 'D', 'i', 's', 'p', 'o', 'n', 'i', 'b', 'i', 'l', 'i', 't', 'é', 'P', 'l', 'e', 'i', 'n', 't', 'e', 'm', 'p', 's', 'L', 'a', 'n', 'g', 'u', 'e', 's', 'F', 'r', 'a', 'n', 'ç', 'a', 'i', 's', 'A', 'n', 'g', 'l', 'a', 'i', 's']","['-Français,Anglais-']",F A U R E C I A   I N F O R M A T I Q U E   T U N I S I E   -   F I T," Description de l'annonce: Our Cybersecurity team is looking for an Incident Response Analyst(m/f) to be based in Tunis.  The Incident Response Analyst will perform IS/IT security incident response tasks within Forvia’s Security Incident Response team (Level 2/3 SOC). This analyst will work closely with the Security Incident and Response Manager. This analyst shall also work with Forvia’s partners, who typically perform EDR detection tasks. He/she shall also contribute to enhance all documentation and procedures and propose/apply all necessary technical improvements to ensure proper responsiveness and efficiency of the team, especially enhancement of playbooks/automation as well as security rules.Principal Duties and ResponsibilitiesDetect and respond to IS/IT security threats within our global corporate landscape, be it production,development or datacenter environmentsExecute on incident response plans, identify root cause and drive mitigations to prevent future occurrencesOperate on all necessary technologies to identify and respond to IS/IT threats (in particular but not limited to our SIEM Elastic Security and our SOAR Palo Alto XSOAR)Request necessary actions and follow up upon execution to other IT teamsParticipate on projects that improve our intrusion detection and incident response capabilitiesParticipate on creation and improvement of incident response procedures and remediation workflows – automation, context and orchestration as codeParticipate on creation and improvement of security detection rules on the SIEMBe part of Faurecia’s first line of defense. We handle active security events and cutting-edge threats from a variety of sources, and you will be part of a 24/7 on call rotationThe ideal candidate will have/be:Education and experience“Cyber Security” relevant University degreeReal interest in the field of Cyber Security3 yearsof experience in Security Incident Response and associated best practicesExperience in identifying, analyzing, scoping, isolating and eradicating malware or hacking threatsUnderstanding of the current threat landscape and adversary tactic, techniques and proceduresKnowledge of enterprise-scale security technologies and capabilities including SIEM (Elastic), incident management (MISP), SOAR, threat intelligence, packet capture, protocol analysis/NetFlow usage, network and system monitoring and logging, malware analysis, firewalling / network filtering, IDS/IPSCapacity to understand, design and enhance incident response processesStrong knowledge in Linux, Windows, and network equipment’s operationKnowledge in cloud technologies and cloud threat protectionKnowledge of network and host-based forensic methodologies, user behavioral analysis and other AI/ML oriented cyber security technologiesScripting skills (Python is intensively used for our playbooks/automations)Key competenciesStress toleranceMethodology, rigorCuriosityStrong written and oral communication skillsTeamworkStrong critical thinking and problem-solving skillsFlexibilityLanguages  English: fluent                         "
Administrateur(trice) Système & Cloud MS 365,2 novembre 2023,loc:             Sousse Riadh,"['D', 'é', 't', 'a', 'i', 'l', 's', 'd', 'e', 'l', 'a', 'n', 'n', 'o', 'n', 'c', 'e', 'R', 'é', 'f', 'é', 'r', 'e', 'n', 'c', 'e', '1', '9', '0', '0', '5', '5', 'P', 'u', 'b', 'l', 'i', 'é', 'e', 'l', 'e', '2', 'n', 'o', 'v', 'e', 'm', 'b', 'r', 'e', '2', '0', '2', '3', 'T', 'y', 'p', 'e', 'd', 'e', 'p', 'o', 's', 't', 'e', 'C', 'D', 'I', 'S', 'I', 'V', 'P', 'S', 't', 'a', 'g', 'e', 'P', 'F', 'E', 'L', 'i', 'e', 'u', 'd', 'e', 't', 'r', 'a', 'v', 'a', 'i', 'l', 'S', 'o', 'u', 's', 's', 'e', 'R', 'i', 'a', 'd', 'h', 'S', 'o', 'u', 's', 's', 'e', 'T', 'u', 'n', 'i', 's', 'i', 'e', 'E', 'x', 'p', 'é', 'r', 'i', 'e', 'n', 'c', 'e', 'M', 'o', 'i', 'n', 's', 'd', 'u', 'n', 'a', 'n', 'É', 't', 'u', 'd', 'e', 'B', 'a', 'c', '5', 'R', 'é', 'm', 'u', 'n', 'é', 'r', 'a', 't', 'i', 'o', 'n', 'p', 'r', 'o', 'p', 'o', 's', 'é', 'e', '1', '0', '0', '0', '1', '6', '0', '0', 'D', 'T', 'M', 'o', 'i', 's', 'D', 'i', 's', 'p', 'o', 'n', 'i', 'b', 'i', 'l', 'i', 't', 'é', 'P', 'l', 'e', 'i', 'n', 't', 'e', 'm', 'p', 's', 'L', 'a', 'n', 'g', 'u', 'e', 's', 'F', 'r', 'a', 'n', 'ç', 'a', 'i', 's', 'A', 'n', 'g', 'l', 'a', 'i', 's']","['-Français,Anglais-']",V I G I L A N T S O C  ," Description de l'annonce: Qui sommes-nous : VigilantSOC est une société de services de sécurité informatique à l’international. Les bureaux sont localisés au pôle de compétitivité de Sousse NOVATION City. Titre : Ingénieur Système Junior - Environnement Microsoft 365 Rôle et Responsabilités : En tant qu'Ingénieur Système Junior spécialisé dans les environnements Microsoft 365, vous jouerez un rôle clé dans la gestion, la maintenance et l'optimisation des solutions cloud de Microsoft. Vous collaborerez étroitement avec les équipes IT et les clients pour déployer, configurer et assurer le bon fonctionnement des services Microsoft 365, en mettant un accent particulier sur Intune, Exchange Online et SharePoint. • Administration et configuration avancées de Microsoft Intune pour la gestion des dispositifs mobiles et des applications. • Gestion des boîtes aux lettres, des politiques de sécurité et de conformité dans Exchange Online. • Configuration et administration de SharePoint Online, y compris la gestion des sites, des bibliothèques et des autorisations. • Assurer la sécurité, l'accessibilité et la cohérence des données au sein de l'environnement Microsoft 365. • Diagnostiquer et résoudre les incidents et dysfonctionnements liés à Microsoft 365. • Participer à l'amélioration continue des services Microsoft 365 en termes de qualité, de sécurité et de productivité. Profil Recherché : • Diplôme de niveau Bac+3 à Bac+5 dans une filière technologique orientée systèmes d'exploitation ou cloud computing. • Passion pour les technologies Microsoft et expertise particulière en Microsoft 365. • Maîtrise du français et de l'anglais technique. • Proactivité, capacité d'analyse et sens du service client. Compétences Techniques : • Maîtrise de Microsoft 365, avec une expertise spécifique en Intune, Exchange Online et SharePoint. • Bonne compréhension des systèmes d’exploitation Microsoft Windows 10/11 et Microsoft Windows Servers. • Compétences avancées en PowerShell pour l'automatisation et la gestion de Microsoft 365. • Connaissance des principes de base de la théorie des systèmes et des réseaux. Compétences Spécifiques : • Certification Microsoft 365 Certified : Modern Desktop Administrator Associate ou équivalent est un plus. • Certification MCSA/MCSE est un avantage. • Connaissance des autres solutions cloud Microsoft telles que Azure AD et Microsoft Teams. Offre Salariale : • Contrat à durée déterminée ou indéterminée, selon profil et expérience. • Rémunération compétitive, adaptée aux compétences et à l’expérience. • Environnement de travail innovant et dynamique. • Formations continues et accompagnement par des experts en solutions cloud Microsoft. • Perspectives d’évolution de carrière à long terme et plan de développement professionnel.                          "
Assistant IT,2 novembre 2023,"loc:                     Tunis,                            Tunisie","['D', 'é', 't', 'a', 'i', 'l', 's', 'd', 'e', 'l', 'a', 'n', 'n', 'o', 'n', 'c', 'e', 'R', 'é', 'f', 'é', 'r', 'e', 'n', 'c', 'e', '1', '9', '0', '0', '8', '8', 'P', 'u', 'b', 'l', 'i', 'é', 'e', 'l', 'e', '2', 'n', 'o', 'v', 'e', 'm', 'b', 'r', 'e', '2', '0', '2', '3', 'T', 'y', 'p', 'e', 'd', 'e', 'p', 'o', 's', 't', 'e', 'C', 'D', 'I', 'C', 'D', 'D', 'S', 'I', 'V', 'P', 'L', 'i', 'e', 'u', 'd', 'e', 't', 'r', 'a', 'v', 'a', 'i', 'l', 'T', 'u', 'n', 'i', 's', 'T', 'u', 'n', 'i', 's', 'i', 'e', 'E', 'x', 'p', 'é', 'r', 'i', 'e', 'n', 'c', 'e', 'A', 'u', 'c', 'u', 'n', 'e', 'e', 'x', 'p', 'é', 'r', 'i', 'e', 'n', 'c', 'e', 'É', 't', 'u', 'd', 'e', 'B', 'a', 'c', '3', 'D', 'i', 's', 'p', 'o', 'n', 'i', 'b', 'i', 'l', 'i', 't', 'é', 'P', 'l', 'e', 'i', 'n', 't', 'e', 'm', 'p', 's', 'L', 'a', 'n', 'g', 'u', 'e', 's', 'A', 'r', 'a', 'b', 'e', 'F', 'r', 'a', 'n', 'ç', 'a', 'i', 's', 'A', 'n', 'g', 'l', 'a', 'i', 's']","['-Arabe,Français,Anglais-']",E X P R E S S   L O G I S T I C   -   U P S," Description de l'annonce:  Recrutement Assistant IT Profil demandé : - Formation universitaire Bac+3 ou plus en réseau et sécurité informatique. - Compétences techniques (câblages, hardware et software, protocoles réseaux...) - Bien organisé, à l'écoute des besoins de personnel et autonome. - Une bonne Capacité d’analyse et de réactivité - Etre responsable, multitâche et minutieux - Capacité de travailler sous pression. - Sociable et adore travailler en équipe. Mission :   Gérer la maintenance préventive ainsi que le support technique.   Installer, paramétrer et faire évoluer les équipements.   Assurer la sécurité du système d'information.   Garantir la confidentialité de toutes les données relatives au poste.   Participer à la sélection, recommandation, au choix et à l’installation de divers nouveaux équipements informatiques.   Procéder au support constant des usagers                            "
Technicienne en Informatique,1 novembre 2023,loc:             Sousse Ville,"['D', 'é', 't', 'a', 'i', 'l', 's', 'd', 'e', 'l', 'a', 'n', 'n', 'o', 'n', 'c', 'e', 'R', 'é', 'f', 'é', 'r', 'e', 'n', 'c', 'e', '1', '8', '9', '9', '4', '3', 'P', 'u', 'b', 'l', 'i', 'é', 'e', 'l', 'e', '1', 'n', 'o', 'v', 'e', 'm', 'b', 'r', 'e', '2', '0', '2', '3', 'T', 'y', 'p', 'e', 'd', 'e', 'p', 'o', 's', 't', 'e', 'S', 'I', 'V', 'P', 'L', 'i', 'e', 'u', 'd', 'e', 't', 'r', 'a', 'v', 'a', 'i', 'l', 'S', 'o', 'u', 's', 's', 'e', 'V', 'i', 'l', 'l', 'e', 'S', 'o', 'u', 's', 's', 'e', 'T', 'u', 'n', 'i', 's', 'i', 'e', 'E', 'x', 'p', 'é', 'r', 'i', 'e', 'n', 'c', 'e', 'A', 'u', 'c', 'u', 'n', 'e', 'e', 'x', 'p', 'é', 'r', 'i', 'e', 'n', 'c', 'e', 'É', 't', 'u', 'd', 'e', 'B', 'a', 'c', '3', 'R', 'é', 'm', 'u', 'n', 'é', 'r', 'a', 't', 'i', 'o', 'n', 'p', 'r', 'o', 'p', 'o', 's', 'é', 'e', '5', '0', '0', '6', '0', '0', 'D', 'T', 'M', 'o', 'i', 's', 'D', 'i', 's', 'p', 'o', 'n', 'i', 'b', 'i', 'l', 'i', 't', 'é', 'P', 'l', 'e', 'i', 'n', 't', 'e', 'm', 'p', 's', 'L', 'a', 'n', 'g', 'u', 'e', 's', 'A', 'r', 'a', 'b', 'e', 'F', 'r', 'a', 'n', 'ç', 'a', 'i', 's', 'A', 'n', 'g', 'l', 'a', 'i', 's']","['-Arabe,Français,Anglais-']",L A B - I T," Description de l'annonce:  Nous sommes à la recherche d'une technicienne en informatique débutante avec une bonne connaissance en informatique pour rejoindre notre équipe. Le candidat sélectionné sera responsable de la gestion de nos stagiaires, de la maintenance de notre site web et de nos réseaux sociaux.  Si vous êtes passionné par le développement web et que vous cherchez à travailler dans un environnement stimulant, cette opportunité est faite pour vous. Responsabilités :  Superviser et encadrer des stagiaires dans leurs tâches quotidiennes. Maintenir notre site web WordPress à jour avec les dernières mises à jour de sécurité et de fonctionnalités. Créer et publier du contenu sur nos réseaux sociaux. Aider à la conception et au développement de nouvelles fonctionnalités pour notre site web. Fournir un soutien technique de base pour les ordinateurs Assister à la mise en place et à la maintenance de notre page Facebook Concevoir et produire des flyers publicitaires pour les événements et promotions de l'entreprise Maintenir l'ordre et la propreté de l'espace de travail Gérer la réception des appels téléphoniques et des courriels entrants  Si vous êtes intéressé par cette opportunité, veuillez soumettre votre CV.   Expérience de travail antérieure dans un poste similaire est un atout, mais pas obligatoire Connaissance de base en informatique (systèmes d'exploitation, logiciels de bureautique, réseaux sociaux, etc.) Excellentes compétences en communication écrite et verbale Capacité à travailler sous pression et à gérer les priorités Capacité à travailler de manière autonome ou en équipe Expérience en développement Web natif sera un plus (HTML, CSS, JavaScript et PHP). Bonne compréhension des principes de conception web et des meilleures pratiques. Maîtrise de WordPress est un plus Capacité à travailler avec des logiciels de design tels qu'Illustrator et Photoshop est un plus. Capacité à travailler efficacement en équipe et à communiquer de manière claire.                            "
RESPONSABLE INFORMATIQUE,1 novembre 2023,"loc:                     Tunis,                            Tunisie","['D', 'é', 't', 'a', 'i', 'l', 's', 'd', 'e', 'l', 'a', 'n', 'n', 'o', 'n', 'c', 'e', 'R', 'é', 'f', 'é', 'r', 'e', 'n', 'c', 'e', '1', '8', '9', '9', '9', '9', 'P', 'u', 'b', 'l', 'i', 'é', 'e', 'l', 'e', '1', 'n', 'o', 'v', 'e', 'm', 'b', 'r', 'e', '2', '0', '2', '3', 'T', 'y', 'p', 'e', 'd', 'e', 'p', 'o', 's', 't', 'e', 'C', 'D', 'D', 'L', 'i', 'e', 'u', 'd', 'e', 't', 'r', 'a', 'v', 'a', 'i', 'l', 'T', 'u', 'n', 'i', 's', 'T', 'u', 'n', 'i', 's', 'i', 'e', 'E', 'x', 'p', 'é', 'r', 'i', 'e', 'n', 'c', 'e', 'E', 'n', 't', 'r', 'e', '2', 'e', 't', '5', 'a', 'n', 's', 'É', 't', 'u', 'd', 'e', 'B', 'a', 'c', '3', 'R', 'é', 'm', 'u', 'n', 'é', 'r', 'a', 't', 'i', 'o', 'n', 'p', 'r', 'o', 'p', 'o', 's', 'é', 'e', '1', '0', '0', '0', '1', '5', '0', '0', 'D', 'T', 'M', 'o', 'i', 's', 'D', 'i', 's', 'p', 'o', 'n', 'i', 'b', 'i', 'l', 'i', 't', 'é', 'P', 'l', 'e', 'i', 'n', 't', 'e', 'm', 'p', 's', 'L', 'a', 'n', 'g', 'u', 'e', 's', 'F', 'r', 'a', 'n', 'ç', 'a', 'i', 's', 'A', 'n', 'g', 'l', 'a', 'i', 's', 'M', 'o', 'b', 'i', 'l', 'i', 't', 'é', 'L', 'o', 'c', 'a', 'l', 'e']","['-Français,Anglais-']",S O T U B I," Description de l'annonce:  LA SOCIETE TUNISIENNE DE BISCUITERIE  SAIDA»   Recrute:  RESPONSABLE  INFORMATIQUE Le responsable  informatique sa mission consiste à: * Gestion  et suivi des serveurs. * Administration  du firewall, antivirus et sauvegarde. * Gestion  du standard téléphonique. * Achat,  dépannage et maintenance du matériel informatique. * Sauvegarde  et restauration des données. * Négociation  avec les fournisseurs des prix et de la qualité de service. Formation requise: * Technicien supérieur en réseaux et services informatiques ou  équivalent.   * Expérience de 3 ans dans un poste similaire. Qualités requises: - Bonne connaissance  sur les réseaux, administration des serveurs (exchange, AD, antivirus...) - Bonne connaissance en Firewall et protection des données et trafic  réseau. - Bon sens de priorité  et d’organisation.                           "
ingénieur informatique industrielle,1 novembre 2023,loc:             Hammam Chatt,"['D', 'é', 't', 'a', 'i', 'l', 's', 'd', 'e', 'l', 'a', 'n', 'n', 'o', 'n', 'c', 'e', 'R', 'é', 'f', 'é', 'r', 'e', 'n', 'c', 'e', '1', '8', '9', '9', '5', '4', 'P', 'u', 'b', 'l', 'i', 'é', 'e', 'l', 'e', '1', 'n', 'o', 'v', 'e', 'm', 'b', 'r', 'e', '2', '0', '2', '3', 'T', 'y', 'p', 'e', 'd', 'e', 'p', 'o', 's', 't', 'e', 'C', 'D', 'I', 'C', 'D', 'D', 'L', 'i', 'e', 'u', 'd', 'e', 't', 'r', 'a', 'v', 'a', 'i', 'l', 'H', 'a', 'm', 'm', 'a', 'm', 'C', 'h', 'a', 't', 't', 'B', 'e', 'n', 'A', 'r', 'o', 'u', 's', 'T', 'u', 'n', 'i', 's', 'i', 'e', 'E', 'x', 'p', 'é', 'r', 'i', 'e', 'n', 'c', 'e', 'E', 'n', 't', 'r', 'e', '2', 'e', 't', '5', 'a', 'n', 's', 'É', 't', 'u', 'd', 'e', 'B', 'a', 'c', '3', 'R', 'é', 'm', 'u', 'n', 'é', 'r', 'a', 't', 'i', 'o', 'n', 'p', 'r', 'o', 'p', 'o', 's', 'é', 'e', '1', 'D', 'T', 'M', 'o', 'i', 's', 'D', 'i', 's', 'p', 'o', 'n', 'i', 'b', 'i', 'l', 'i', 't', 'é', 'P', 'l', 'e', 'i', 'n', 't', 'e', 'm', 'p', 's', 'L', 'a', 'n', 'g', 'u', 'e', 's', 'A', 'r', 'a', 'b', 'e', 'F', 'r', 'a', 'n', 'ç', 'a', 'i', 's', 'A', 'n', 'g', 'l', 'a', 'i', 's', 'M', 'o', 'b', 'i', 'l', 'i', 't', 'é', 'L', 'o', 'c', 'a', 'l', 'e', 'I', 'n', 't', 'e', 'r', 'n', 'a', 't', 'i', 'o', 'n', 'a', 'l']","['-Arabe,Français,Anglais-']",S N A," Description de l'annonce: SNAfiliale de Poulina Group Holding, cherche à renforcer son capital humain par le recrutement d'un responsable ingénieur automatisme et informatique industrielle qui a aura pour mission :--Administration réseaux Automatisme usine Secteur Aliment.  -Administration système du logiciel de Production. -Administration  Coswin ALLIX3 et liaison avec le logiciel de production. -Administration sécurité système d'information (logiciel et  matériel). -Gestion du parc informatique automatisme : diagnostic et  réparation du matériel informatique. -Assurer un fonctionnement optimal du système informatique de  la SNA.  -Assurer une sécurité optimale du système de la SNA. -Assurer la fiabilité et la sécurité du système informatique.   -Assurer le développement informatique de la SNA. -Assurer la résolution des problèmes matériels dans l'usine. -Assurer l'administration et la gestion du système  informatique de l'usine en relation avec les autres systèmes. -Assurer la sécurité du système informatique IndustrielleProfil :De formation ingénieur en informatique , automatisme ou informatique industrielleVous possédez idéalement une première expérience au moins 3 ans dans un poste similaire .Vous avez le sens du leadership et de travail en équipes pluridisciplinaires.Vous êtes reconnu pour votre rigueur, organisation, autonomie                         "
