Service Desk Analyst / langue Espagnol,6 novembre 2023,"loc:                     Tunis,                            Tunisie","['D', 'é', 't', 'a', 'i', 'l', 's', 'd', 'e', 'l', 'a', 'n', 'n', 'o', 'n', 'c', 'e', 'R', 'é', 'f', 'é', 'r', 'e', 'n', 'c', 'e', '1', '9', '0', '2', '2', '7', 'P', 'u', 'b', 'l', 'i', 'é', 'e', 'l', 'e', '6', 'n', 'o', 'v', 'e', 'm', 'b', 'r', 'e', '2', '0', '2', '3', 'T', 'y', 'p', 'e', 'd', 'e', 'p', 'o', 's', 't', 'e', 'C', 'D', 'I', 'L', 'i', 'e', 'u', 'd', 'e', 't', 'r', 'a', 'v', 'a', 'i', 'l', 'T', 'u', 'n', 'i', 's', 'T', 'u', 'n', 'i', 's', 'i', 'e', 'E', 'x', 'p', 'é', 'r', 'i', 'e', 'n', 'c', 'e', 'E', 'n', 't', 'r', 'e', '1', 'e', 't', '2', 'a', 'n', 's', 'É', 't', 'u', 'd', 'e', 'B', 'a', 'c', '3', 'R', 'é', 'm', 'u', 'n', 'é', 'r', 'a', 't', 'i', 'o', 'n', 'p', 'r', 'o', 'p', 'o', 's', 'é', 'e', '1', '2', '0', '0', '1', '5', '0', '0', 'D', 'T', 'M', 'o', 'i', 's', 'D', 'i', 's', 'p', 'o', 'n', 'i', 'b', 'i', 'l', 'i', 't', 'é', 'P', 'l', 'e', 'i', 'n', 't', 'e', 'm', 'p', 's', 'L', 'a', 'n', 'g', 'u', 'e', 's', 'E', 's', 'p', 'a', 'g', 'n', 'o', 'l']",[],E V E R I E N C E," Description de l'annonce:   Misión:      ¿Y si eliges algo más que un trabajo? Usted tiene la posibilidad de iniciar un viaje en el campo de TI, Nuestro negocio principal es el soporte informático. Le ofrecemos: Recorridos que te inspiran a ti  Y una empresa responsable que se compromete,   El Técnico de soporte debe:   -Diagnóstico remoto de mal funcionamiento de hardware o software  -Configurar la estación de trabajo a las necesidades del usuario y realizar las pruebas de funcionamiento  - Guía al usuario para resolver el incidente o tomar el control remoto del Sistema  -Escalar los incidentes no resueltos si es necesario, prestando atención a los compromisos de tiempo de intervención, y mantener informado al usuario  -Realiza una descripción precisa de la intervención después de cada llamada e introduce los campos necesarios en la herramienta de gestión de incidentes   Perfil:       - Apasionado, graduado en Informática, o usted tiene una experiencia mínima de 2 años en soporte de usuario o centro de contacto - Estás recién graduado o pensando en una reconversión profesional - Usted habla principalmente el español - Es flexible en un amplio rango de horas y/o busca un trabajo híbrido                              "
TECHNICIEN SUPPORT LINUX N2 - 24/7 H/F,6 novembre 2023,"loc:                     Tunis,                            Tunisie","['D', 'é', 't', 'a', 'i', 'l', 's', 'd', 'e', 'l', 'a', 'n', 'n', 'o', 'n', 'c', 'e', 'R', 'é', 'f', 'é', 'r', 'e', 'n', 'c', 'e', '1', '9', '0', '2', '2', '6', 'P', 'u', 'b', 'l', 'i', 'é', 'e', 'l', 'e', '6', 'n', 'o', 'v', 'e', 'm', 'b', 'r', 'e', '2', '0', '2', '3', 'T', 'y', 'p', 'e', 'd', 'e', 'p', 'o', 's', 't', 'e', 'C', 'D', 'I', 'L', 'i', 'e', 'u', 'd', 'e', 't', 'r', 'a', 'v', 'a', 'i', 'l', 'T', 'u', 'n', 'i', 's', 'T', 'u', 'n', 'i', 's', 'i', 'e', 'E', 'x', 'p', 'é', 'r', 'i', 'e', 'n', 'c', 'e', 'E', 'n', 't', 'r', 'e', '1', 'e', 't', '2', 'a', 'n', 's', 'É', 't', 'u', 'd', 'e', 'B', 'a', 'c', '3', 'R', 'é', 'm', 'u', 'n', 'é', 'r', 'a', 't', 'i', 'o', 'n', 'p', 'r', 'o', 'p', 'o', 's', 'é', 'e', '1', '2', '0', '0', '1', '5', '0', '0', 'D', 'T', 'M', 'o', 'i', 's', 'D', 'i', 's', 'p', 'o', 'n', 'i', 'b', 'i', 'l', 'i', 't', 'é', 'P', 'l', 'e', 'i', 'n', 't', 'e', 'm', 'p', 's', 'L', 'a', 'n', 'g', 'u', 'e', 's', 'F', 'r', 'a', 'n', 'ç', 'a', 'i', 's', 'A', 'n', 'g', 'l', 'a', 'i', 's']","['-Français,Anglais-']",E V E R I E N C E," Description de l'annonce: Dans le cadre de sa croissance soutenue et le développement de  son business, EVERIENCE est en recherche active de nouveaux potentiels, prêts à  relever les challenges à venir.Profil recherché:Titulaire d'un diplôme en Informatique (Licence-Maîtrise ou Master)Vous parlez couramment lefrançais et l'anglais (Niv C1/C2)Disponibilité 24/7 ( y compris shifts de nuits)Avoir une vision très générale du monde vocal, infra, télécomExpérience confirmée en relation client dans un centre de serviceConnaissances en maintenance des systèmes d’informationsBon niveau de communicationCapacité d’écoute et bonnes compétences interpersonnellesRapidité de traitement et de prise en charge et une bonne organisationCertificationLinuxRED HATest appréciée .Missions:Au sein d’une équipe support  professionnelle Multilingues; vous aurez la responsabilité de:Assurer unsuivi des différents serveurs et dossiers en cours.Garantir le traitement des demandes des utilisateurs via desoutils de monitoring et des courriels.Effectuer un diagnostic approfondi et troubleshouting sur WINSERVER – UNIX et LINUX.Escalader la demande dans les délais vers le centre compétent pour prise en charge et résolutionMaintenir le dialogue entre les différents niveaux de soutienContribuer à améliorer les services et à respecter les engagements contractuels et les règles de sécuritéNous vous offrons: Contrat de travail à durée indéterminée Bon niveau de rémunération, primes de production       ,tickets restaurant, assurance maladie, etc.. Environnement de travail jeune et dynamique, plan de       développement de carrière, formations continues. etc... Référence :TU/TSD24-7/1119/009158 à mentionner impérativement en Objet de votre candidature                         "
UI/Web Developer Senior,6 novembre 2023,"loc:                     Tunis,                            Tunisie","['D', 'é', 't', 'a', 'i', 'l', 's', 'd', 'e', 'l', 'a', 'n', 'n', 'o', 'n', 'c', 'e', 'R', 'é', 'f', 'é', 'r', 'e', 'n', 'c', 'e', '1', '9', '0', '2', '8', '3', 'P', 'u', 'b', 'l', 'i', 'é', 'e', 'l', 'e', '6', 'n', 'o', 'v', 'e', 'm', 'b', 'r', 'e', '2', '0', '2', '3', 'L', 'i', 'e', 'u', 'd', 'e', 't', 'r', 'a', 'v', 'a', 'i', 'l', 'T', 'u', 'n', 'i', 's', 'T', 'u', 'n', 'i', 's', 'i', 'e', 'E', 'x', 'p', 'é', 'r', 'i', 'e', 'n', 'c', 'e', 'E', 'n', 't', 'r', 'e', '5', 'e', 't', '1', '0', 'a', 'n', 's', 'É', 't', 'u', 'd', 'e', 'B', 'a', 'c', '5', 'R', 'é', 'm', 'u', 'n', 'é', 'r', 'a', 't', 'i', 'o', 'n', 'p', 'r', 'o', 'p', 'o', 's', 'é', 'e', '1', '2', 'D', 'T', 'M', 'o', 'i', 's', 'D', 'i', 's', 'p', 'o', 'n', 'i', 'b', 'i', 'l', 'i', 't', 'é', 'P', 'l', 'e', 'i', 'n', 't', 'e', 'm', 'p', 's', 'L', 'a', 'n', 'g', 'u', 'e', 's', 'A', 'r', 'a', 'b', 'e', 'F', 'r', 'a', 'n', 'ç', 'a', 'i', 's', 'A', 'n', 'g', 'l', 'a', 'i', 's']","['-Arabe,Français,Anglais-']",S T R E A M W I D E," Description de l'annonce:  Position Summary : As a JavaScript Developer you need to develop cross-browser, standards compliant web applications using web technologies like HTML 5, CSS 3, JavaScript / jQuery and WebSockets for the TEAM ON THE RUN and customer platforms. You will work closely with the Marketing department, designers and other JavaScript and Backend developers within a fast paced environment. New features and enhancements roll out almost every month. You will develop new feature or enhance the existing ones in the following domains: • Messaging • Corporate directory • VoIP Calls • Geolocation • Task and Business Process management For more details about Team on the Run please access the Team on the Run website and the YouTube channel.  Mandatory Skills : • Minimum of 2 years' experience in a similar position • Excellent knowledge of HTML 5, CSS 3 and JavaScript • Experience working with JQuery, LESS and Bootstrap • Experience debugging typical CSS and JavaScript issues • ViewJS/NodeJS experience, PHP appreciated • Cross-browser design implementation • Good understanding of browser rendering behavior and performance • Experience using PHP frameworks (Zend, Symfony etc) for developing web applications • Version control software experience (Git, Mercurial, Subversion) • Person with initiative and ability to work as part of a team • Good level in spoken and written English Appreciated Skills : • Experience with large scale projects / products development • Experience with web services (REST, XML-RPC, JSON-RPC, SOAP) • Zend Framework experience • TypeScript experience, OOP experience We offer : • Competitive salary package • Annual bonuses • Restaurant tickets • Medical subscription for family                            "
Service Desk analyst H/F,6 novembre 2023,"loc:                     Tunis,                            Tunisie","['D', 'é', 't', 'a', 'i', 'l', 's', 'd', 'e', 'l', 'a', 'n', 'n', 'o', 'n', 'c', 'e', 'R', 'é', 'f', 'é', 'r', 'e', 'n', 'c', 'e', '1', '9', '0', '2', '2', '9', 'P', 'u', 'b', 'l', 'i', 'é', 'e', 'l', 'e', '6', 'n', 'o', 'v', 'e', 'm', 'b', 'r', 'e', '2', '0', '2', '3', 'T', 'y', 'p', 'e', 'd', 'e', 'p', 'o', 's', 't', 'e', 'C', 'D', 'I', 'L', 'i', 'e', 'u', 'd', 'e', 't', 'r', 'a', 'v', 'a', 'i', 'l', 'T', 'u', 'n', 'i', 's', 'T', 'u', 'n', 'i', 's', 'i', 'e', 'E', 'x', 'p', 'é', 'r', 'i', 'e', 'n', 'c', 'e', 'E', 'n', 't', 'r', 'e', '1', 'e', 't', '2', 'a', 'n', 's', 'É', 't', 'u', 'd', 'e', 'B', 'a', 'c', '2', 'R', 'é', 'm', 'u', 'n', 'é', 'r', 'a', 't', 'i', 'o', 'n', 'p', 'r', 'o', 'p', 'o', 's', 'é', 'e', '1', '0', '0', '0', '1', '3', '0', '0', 'D', 'T', 'M', 'o', 'i', 's', 'D', 'i', 's', 'p', 'o', 'n', 'i', 'b', 'i', 'l', 'i', 't', 'é', 'P', 'l', 'e', 'i', 'n', 't', 'e', 'm', 'p', 's', 'L', 'a', 'n', 'g', 'u', 'e', 's', 'F', 'r', 'a', 'n', 'ç', 'a', 'i', 's', 'A', 'n', 'g', 'l', 'a', 'i', 's']","['-Français,Anglais-']",E V E R I E N C E," Description de l'annonce: Et si vous choisissez plus qu’un job? Vous avez la  possibilité d’entamer un parcours dans le domaine IT, Notre cœur de métier est  le support informatique. On vous offre: Des Parcours qui vous inspirent Des Formations certifiantes Et Une entreprise Responsable qui s’engage, Le Technicien support est amené à: ·  Diagnostiquer à distance un dysfonctionnement  informatique matériel ou logiciel ·  Configurer le poste de travail aux besoins de  l'utilisateur et effectuer les tests de fonctionnement ·  Guider l'utilisateur pour résoudre l’incident ou  prendre le contrôle du système à distance ·  Vous escaladez si besoin les incidents non  résolus en restant attentif aux engagements de délai des interventions, et vous  tenez informé l’utilisateur ·  Vous réalisez un descriptif précis de  l’intervention après chaque appel et renseignez les champs nécessaires dans  l’outil de gestion des incidents Pour mener à bien votre mission, vous bénéficierez d’une  formation métier (rémunérée dès votre intégration) dans un cadre agréable et convivial,  des formations certifiantes débouchant sur une perspective d’évolution, un  package salarial attractif et de multiples avantages (exemples: prime de  transport, assurance groupe, primes de mariage/scolarité, possibilité de  télétravail et à temps partiel, forfait téléphonique illimité + 55Go/mois…) Profil recherché  : ·  Passionné, diplômé en Informatique, ou vous  possédez une expérience de 2 ans minimumen support utilisateursou  en centre de contact ·  Vous êtes fraichement diplômé ou pensez à une reconversion  professionnelle ·  Vous parlez aisément le Français et/ou l’Anglais ·  Vous êtes flexible sur une large plage horaire  et/ou cherchez un travail hybride Si cela vous parle n’attendez plus et  rejoignez-nous!!!! Référence : TU/TSDC/0420/009928                          "
Senior QA Engineer,6 novembre 2023,"loc:                     Tunis,                            Tunisie","['D', 'é', 't', 'a', 'i', 'l', 's', 'd', 'e', 'l', 'a', 'n', 'n', 'o', 'n', 'c', 'e', 'R', 'é', 'f', 'é', 'r', 'e', 'n', 'c', 'e', '1', '9', '0', '2', '8', '4', 'P', 'u', 'b', 'l', 'i', 'é', 'e', 'l', 'e', '6', 'n', 'o', 'v', 'e', 'm', 'b', 'r', 'e', '2', '0', '2', '3', 'T', 'y', 'p', 'e', 'd', 'e', 'p', 'o', 's', 't', 'e', 'C', 'D', 'I', 'S', 'I', 'V', 'P', 'L', 'i', 'e', 'u', 'd', 'e', 't', 'r', 'a', 'v', 'a', 'i', 'l', 'T', 'u', 'n', 'i', 's', 'T', 'u', 'n', 'i', 's', 'i', 'e', 'E', 'x', 'p', 'é', 'r', 'i', 'e', 'n', 'c', 'e', 'E', 'n', 't', 'r', 'e', '2', 'e', 't', '5', 'a', 'n', 's', 'É', 't', 'u', 'd', 'e', 'B', 'a', 'c', '5', 'R', 'é', 'm', 'u', 'n', 'é', 'r', 'a', 't', 'i', 'o', 'n', 'p', 'r', 'o', 'p', 'o', 's', 'é', 'e', '1', '2', 'D', 'T', 'M', 'o', 'i', 's', 'D', 'i', 's', 'p', 'o', 'n', 'i', 'b', 'i', 'l', 'i', 't', 'é', 'P', 'l', 'e', 'i', 'n', 't', 'e', 'm', 'p', 's', 'L', 'a', 'n', 'g', 'u', 'e', 's', 'A', 'r', 'a', 'b', 'e', 'F', 'r', 'a', 'n', 'ç', 'a', 'i', 's', 'A', 'n', 'g', 'l', 'a', 'i', 's']","['-Arabe,Français,Anglais-']",S T R E A M W I D E," Description de l'annonce:    DESCRIPTION   Le QA Engineer est responsable de    l'assurance qualité logiciel pour nous assurer que toutes les exigences    externes et internes sont satisfaites avant que notre produit ne soit déployé    chez nos clients.  Il sera responsable de l'inspection et du    respect des procédures, des résultats et de l'identification des erreurs ou    des problèmes de non-conformité.     MISSIONS    Examiner les         exigences, les spécifications et les documents de conception technique. Définir des         processus pour créer des plans de test et des cas de test détaillés,         complets et bien structurés Développer des         tests automatisés pour la validation des plans de tests Estimer, planifier         et coordonner les activités de test dans le cadre du process Less-Scrum Transmettre son         expérience aux QA juniors Identifier, enregistrer,         documenter et suivre les bugs Assurer la         conformité aux normes et standards de l'industrie, Suivre les         non-conformités relevées jusqu’à leur clôture  Etablissement et         suivi des KPIs/métriques d'assurance qualité (Processus et Produit) Restez à jour avec         les nouveaux outils de test et stratégies de test Garantir le         respect des processus applicables et la conformité des produits livrés.      PROFIL    Etudes d’ingénieur         en informatique ou Master en informatique Expérience de         travail éprouvée dans l'assurance qualité logiciel (3-5 ans) Connaissance d’un         langage de développement pour les tests (Java ou javascript) Connaissance de         Linux (configuration de base, shell scripting) Expérience des         outils de test et d’intégration continue : Selenium et Jenkins Solide         connaissance des méthodologies, des outils et des processus QA Expérience de la         rédaction de plans de test et de cas de test clairs, concis et complets Expérience de         travail dans un processus de développement Agile / Scrum Une expérience des         tests de performance et / ou de sécurité est un plus Curieux. A l’aise avec le         mentorat. Excellente         communication orale et écrite en anglais                             "
INGENIEURS SYSTEME ET RESEAU,6 novembre 2023,"loc:                     Tunis,                            Tunisie","['D', 'é', 't', 'a', 'i', 'l', 's', 'd', 'e', 'l', 'a', 'n', 'n', 'o', 'n', 'c', 'e', 'R', 'é', 'f', 'é', 'r', 'e', 'n', 'c', 'e', '1', '9', '0', '2', '8', '5', 'P', 'u', 'b', 'l', 'i', 'é', 'e', 'l', 'e', '6', 'n', 'o', 'v', 'e', 'm', 'b', 'r', 'e', '2', '0', '2', '3', 'T', 'y', 'p', 'e', 'd', 'e', 'p', 'o', 's', 't', 'e', 'C', 'D', 'I', 'S', 'I', 'V', 'P', 'L', 'i', 'e', 'u', 'd', 'e', 't', 'r', 'a', 'v', 'a', 'i', 'l', 'T', 'u', 'n', 'i', 's', 'T', 'u', 'n', 'i', 's', 'i', 'e', 'E', 'x', 'p', 'é', 'r', 'i', 'e', 'n', 'c', 'e', 'E', 'n', 't', 'r', 'e', '2', 'e', 't', '5', 'a', 'n', 's', 'É', 't', 'u', 'd', 'e', 'B', 'a', 'c', '5', 'R', 'é', 'm', 'u', 'n', 'é', 'r', 'a', 't', 'i', 'o', 'n', 'p', 'r', 'o', 'p', 'o', 's', 'é', 'e', '1', '2', 'D', 'T', 'M', 'o', 'i', 's', 'D', 'i', 's', 'p', 'o', 'n', 'i', 'b', 'i', 'l', 'i', 't', 'é', 'P', 'l', 'e', 'i', 'n', 't', 'e', 'm', 'p', 's', 'L', 'a', 'n', 'g', 'u', 'e', 's', 'A', 'r', 'a', 'b', 'e', 'F', 'r', 'a', 'n', 'ç', 'a', 'i', 's', 'A', 'n', 'g', 'l', 'a', 'i', 's']","['-Arabe,Français,Anglais-']",S T R E A M W I D E," Description de l'annonce: Principales activités et responsabilités : ·  Responsabilité du support au Client sur les produits  de l’entreprise ·  Maintient fonctionnel de l’infrastructure du réseau  interne ·  Maintient fonctionnel de la sécurité informatique de l’entreprise ·  Assurer une astreinte Téléphonique Client Pré requis de la fonction – Qualifications,  expérience, compétences : ·  Bac +5 avec une expérience d’au moins 3 ans dans  l’administration et le support Réseau ·  Linux ,Cisco (Routeurs & Catalyst), PHP, Mysql ·  IP (RIP, OSPF, BGP,  EIGRP, IS-IS) ·  VLAN (802.1Q); VOIP SIP ·  Shell (scripting) ·  Nagios ·  Réactivité, disponibilité, dynamisme ·  Solides capacités  d’analyse, de synthèse et organisationnelle ·  Très grande rigueur  et sens du travail d’équipe ·  Anglais courant ·  Bon relationnel et ouverture d'esprit                         "
Graphic Designer / community manager,5 novembre 2023,"loc:             Moknine,                            Monastir","['D', 'é', 't', 'a', 'i', 'l', 's', 'd', 'e', 'l', 'a', 'n', 'n', 'o', 'n', 'c', 'e', 'R', 'é', 'f', 'é', 'r', 'e', 'n', 'c', 'e', '1', '9', '0', '1', '9', '0', 'P', 'u', 'b', 'l', 'i', 'é', 'e', 'l', 'e', '5', 'n', 'o', 'v', 'e', 'm', 'b', 'r', 'e', '2', '0', '2', '3', 'T', 'y', 'p', 'e', 'd', 'e', 'p', 'o', 's', 't', 'e', 'S', 'I', 'V', 'P', 'L', 'i', 'e', 'u', 'd', 'e', 't', 'r', 'a', 'v', 'a', 'i', 'l', 'M', 'o', 'k', 'n', 'i', 'n', 'e', 'M', 'o', 'n', 'a', 's', 't', 'i', 'r', 'T', 'u', 'n', 'i', 's', 'i', 'e', 'E', 'x', 'p', 'é', 'r', 'i', 'e', 'n', 'c', 'e', 'M', 'o', 'i', 'n', 's', 'd', 'u', 'n', 'a', 'n', 'É', 't', 'u', 'd', 'e', 'F', 'o', 'r', 'm', 'a', 't', 'i', 'o', 'n', 's', 'p', 'r', 'o', 'f', 'e', 's', 's', 'i', 'o', 'n', 'n', 'e', 'l', 'l', 'e', 's', 'R', 'é', 'm', 'u', 'n', 'é', 'r', 'a', 't', 'i', 'o', 'n', 'p', 'r', 'o', 'p', 'o', 's', 'é', 'e', '5', '0', '0', '8', '0', '0', 'D', 'T', 'M', 'o', 'i', 's', 'D', 'i', 's', 'p', 'o', 'n', 'i', 'b', 'i', 'l', 'i', 't', 'é', 'P', 'l', 'e', 'i', 'n', 't', 'e', 'm', 'p', 's', 'L', 'a', 'n', 'g', 'u', 'e', 's', 'A', 'r', 'a', 'b', 'e', 'F', 'r', 'a', 'n', 'ç', 'a', 'i', 's']","['-Arabe,Français-']",," Description de l'annonce:  Nous sommes à la recherche d'un(e) infographiste polyvalent(e) possédant des compétences en community management pour rejoindre notre équipe créative. Vous serez responsable de la création de visuels attrayants et de la gestion de notre présence sur les médias sociaux pour promouvoir nos produits et engager notre audience.   𝐑𝐞𝐬𝐩𝐨𝐧𝐬𝐚𝐛𝐢𝐥𝐢𝐭𝐞́𝐬 :   Concevoir des visuels percutants, des graphiques et des images pour nos campagnes marketing.   Gérer et animer nos comptes sur les réseaux sociaux   Créer du contenu engageant, y compris des publications, des histoires, des vidéos   Suivre les tendances des médias sociaux et adapter la stratégie en conséquence.   Collaborer étroitement avec l'équipe marketing pour assurer la cohérence de la marque.   𝐄𝐱𝐢𝐠𝐞𝐧𝐜𝐞𝐬 :   Connaissance des outils de conception tels que Adobe Photoshop, Illustrator, etc.   Connaissance médias sociaux et des meilleures pratiques en community management.   Capacité à créer du contenu original et engageant.   Excellentes compétences en communication écrite et orale.   Créativité, souci du détail, et capacité à respecter les délais.   Nous sommes impatients de découvrir comment votre créativité et votre expertise renforceront notre présence en ligne et l'impact de notre entreprise.    Envoyez votre CV et votre portfolio                         "
Graphiste,5 novembre 2023,loc:             La Soukra,"['D', 'é', 't', 'a', 'i', 'l', 's', 'd', 'e', 'l', 'a', 'n', 'n', 'o', 'n', 'c', 'e', 'R', 'é', 'f', 'é', 'r', 'e', 'n', 'c', 'e', '1', '9', '0', '1', '6', '6', 'P', 'u', 'b', 'l', 'i', 'é', 'e', 'l', 'e', '5', 'n', 'o', 'v', 'e', 'm', 'b', 'r', 'e', '2', '0', '2', '3', 'T', 'y', 'p', 'e', 'd', 'e', 'p', 'o', 's', 't', 'e', 'C', 'D', 'I', 'C', 'D', 'D', 'S', 'I', 'V', 'P', 'L', 'i', 'e', 'u', 'd', 'e', 't', 'r', 'a', 'v', 'a', 'i', 'l', 'L', 'a', 'S', 'o', 'u', 'k', 'r', 'a', 'A', 'r', 'i', 'a', 'n', 'a', 'T', 'u', 'n', 'i', 's', 'i', 'e', 'E', 'x', 'p', 'é', 'r', 'i', 'e', 'n', 'c', 'e', 'E', 'n', 't', 'r', 'e', '2', 'e', 't', '5', 'a', 'n', 's', 'É', 't', 'u', 'd', 'e', 'B', 'a', 'c', '5', 'R', 'é', 'm', 'u', 'n', 'é', 'r', 'a', 't', 'i', 'o', 'n', 'p', 'r', 'o', 'p', 'o', 's', 'é', 'e', '5', '0', '0', '1', '0', '0', '0', 'D', 'T', 'M', 'o', 'i', 's', 'D', 'i', 's', 'p', 'o', 'n', 'i', 'b', 'i', 'l', 'i', 't', 'é', 'P', 'l', 'e', 'i', 'n', 't', 'e', 'm', 'p', 's', 'L', 'a', 'n', 'g', 'u', 'e', 's', 'A', 'r', 'a', 'b', 'e', 'F', 'r', 'a', 'n', 'ç', 'a', 'i', 's', 'A', 'n', 'g', 'l', 'a', 'i', 's']","['-Arabe,Français,Anglais-']",L E S P O R T I F," Description de l'annonce:  Rejoignez notre équipe en tant que Graphiste Spécialisé en Photo et Vidéo et participez à la création de contenus visuels captivants et percutants. En tant que professionnel créatif, vous jouerez un rôle clé dans la conception graphique, le montage vidéo et la retouche photo, contribuant ainsi à renforcer la présence de notre entreprise sur différentes plateformes. Responsabilités :  Concevoir des designs graphiques originaux pour divers supports, en respectant notre charte graphique et en utilisant des outils tels qu'Adobe Photoshop et Illustrator. Monter et assembler des séquences vidéo pour créer des contenus dynamiques et attrayants en utilisant des logiciels de montage vidéo tels qu'Adobe Premiere Pro ou Final Cut Pro. Retoucher et améliorer la qualité des images photographiques, en ajustant les couleurs, les contrastes et en éliminant les imperfections. Créer des contenus multimédias variés, tels que des diaporamas, des vidéos promotionnelles et des animations simples, en collaboration avec l'équipe marketing. Assurer le respect des normes de qualité de notre entreprise et des délais de production pour garantir une diffusion efficace des contenus visuels. Collaborer étroitement avec l'équipe créative, le marketing et les rédacteurs pour intégrer harmonieusement les éléments visuels dans nos projets.  Compétences Requises :  Maîtrise des logiciels de conception graphique tels que Adobe Photoshop et Illustrator. Solides compétences en montage vidéo avec des logiciels tels qu'Adobe Premiere Pro, Final Cut Pro, etc. Compréhension approfondie des principes de conception graphique, de la typographie et de la mise en page. Connaissance des techniques de retouche photo et de correction d'image. Capacité à innover tout en respectant les directives de marque. Expérience en animation et en effets visuels est un plus. Excellentes aptitudes en communication et en travail d'équipe.  Qualifications :  Diplôme en design graphique, multimédia, arts visuels ou domaine similaire. Portefolio démontrant des exemples de travaux de conception graphique, de montage vidéo et de retouche photo.                             "
technicien informatique,5 novembre 2023,loc:             Sfax Ville,"['D', 'é', 't', 'a', 'i', 'l', 's', 'd', 'e', 'l', 'a', 'n', 'n', 'o', 'n', 'c', 'e', 'R', 'é', 'f', 'é', 'r', 'e', 'n', 'c', 'e', '1', '9', '0', '1', '5', '5', 'P', 'u', 'b', 'l', 'i', 'é', 'e', 'l', 'e', '5', 'n', 'o', 'v', 'e', 'm', 'b', 'r', 'e', '2', '0', '2', '3', 'T', 'y', 'p', 'e', 'd', 'e', 'p', 'o', 's', 't', 'e', 'S', 'I', 'V', 'P', 'L', 'i', 'e', 'u', 'd', 'e', 't', 'r', 'a', 'v', 'a', 'i', 'l', 'S', 'f', 'a', 'x', 'V', 'i', 'l', 'l', 'e', 'S', 'f', 'a', 'x', 'T', 'u', 'n', 'i', 's', 'i', 'e', 'E', 'x', 'p', 'é', 'r', 'i', 'e', 'n', 'c', 'e', 'A', 'u', 'c', 'u', 'n', 'e', 'e', 'x', 'p', 'é', 'r', 'i', 'e', 'n', 'c', 'e', 'É', 't', 'u', 'd', 'e', 'B', 'a', 'c', '3', 'R', 'é', 'm', 'u', 'n', 'é', 'r', 'a', 't', 'i', 'o', 'n', 'p', 'r', 'o', 'p', 'o', 's', 'é', 'e', '1', 'D', 'T', 'M', 'o', 'i', 's', 'D', 'i', 's', 'p', 'o', 'n', 'i', 'b', 'i', 'l', 'i', 't', 'é', 'P', 'l', 'e', 'i', 'n', 't', 'e', 'm', 'p', 's', 'L', 'a', 'n', 'g', 'u', 'e', 's', 'A', 'r', 'a', 'b', 'e', 'F', 'r', 'a', 'n', 'ç', 'a', 'i', 's', 'A', 'n', 'g', 'l', 'a', 'i', 's', 'M', 'o', 'b', 'i', 'l', 'i', 't', 'é', 'L', 'o', 'c', 'a', 'l', 'e']","['-Arabe,Français,Anglais-']",T A O U F I K   B E N   H A M I D A," Description de l'annonce: Nous sommes actuellement à la recherche d'un technicien débutant en maintenance informatique et installation réseaux locaux pour rejoindre notre équipeLes tâches principales comprennent :Effectuer la maintenance préventive et corrective des équipements informatiques (unités centrales, imprimantes, écrans, etc.)Identifier et diagnostiquer les problèmes liés aux équipements informatiques et proposer des solutions adaptéesInstaller, configurer et mettre à jour les systèmes d'exploitation, les logiciels et les périphériquesInstaller, configurer et dépanner les réseaux locaux (Ethernet)Fournir un support technique à distance et sur siteGérer les tickets d'incidents et les demandes de support techniqueAssurer une communication régulière avec les clients pour garantir leur satisfaction                         "
