Consultant Junior Cyber Sécurité,3 novembre 2023,"loc:                     Tunis,                            Tunisie","['D', 'é', 't', 'a', 'i', 'l', 's', 'd', 'e', 'l', 'a', 'n', 'n', 'o', 'n', 'c', 'e', 'R', 'é', 'f', 'é', 'r', 'e', 'n', 'c', 'e', '1', '9', '0', '1', '4', '0', 'P', 'u', 'b', 'l', 'i', 'é', 'e', 'l', 'e', '3', 'n', 'o', 'v', 'e', 'm', 'b', 'r', 'e', '2', '0', '2', '3', 'L', 'i', 'e', 'u', 'd', 'e', 't', 'r', 'a', 'v', 'a', 'i', 'l', 'T', 'u', 'n', 'i', 's', 'T', 'u', 'n', 'i', 's', 'i', 'e', 'E', 'x', 'p', 'é', 'r', 'i', 'e', 'n', 'c', 'e', 'M', 'o', 'i', 'n', 's', 'd', 'u', 'n', 'a', 'n', 'É', 't', 'u', 'd', 'e', 'B', 'a', 'c', '5', 'D', 'i', 's', 'p', 'o', 'n', 'i', 'b', 'i', 'l', 'i', 't', 'é', 'P', 'l', 'e', 'i', 'n', 't', 'e', 'm', 'p', 's', 'L', 'a', 'n', 'g', 'u', 'e', 's', 'F', 'r', 'a', 'n', 'ç', 'a', 'i', 's']",[],B I N I T N S," Description de l'annonce: Binit Nearshore Services (BinitNS) est une société de  Conseil et de Services opérant dans le domaine de l’ITO et du BPO. Nous  conseillons nos clients Européens sur leur Stratégie IT dans le domaine de  l’Infrastructure, de la Cybersécurité et du développement/choix des solutions  métiers. Nous les accompagnons aussi dans le cadre de leur installation en  Tunisie et le recrutement de leurs équipes nearshore en extension de leurs  équipes européennes. Dans ce cadre, nous recherchons un consultant en  cybersécurité pour rejoindre notre équipe. Les principales responsabilités incluent: · Évaluation de la  maturité en cybersécurité de l'entreprise, tests d'intrusion et revues des  configurations. · Établissement de  feuilles de route à court et moyen terme pour renforcer la posture de  cybersécurité. · Mise en œuvre des  mesures de sécurité, remédiation des vulnérabilités et préparation à la  certification ISO 27001. Le candidat retenu participera également aux services  managés, notamment : · Réponse aux  incidents, enquêtes et surveillance continue des sujets de cybersécurité. · Collecte  d'informations à partir de diverses sources et évaluation du niveau de risque. · Formation et  sensibilisation à la cybersécurité, ainsi que la possibilité de travailler au  sein d'un service SOC. Si vous êtes passionné par la cybersécurité et que vous  souhaitez contribuer à la protection des systèmes d'information, rejoignez  notre équipe dynamique et développez votre carrière en tant que consultant en  cybersécurité Rémunération attractive. Date de début : Au plus tôt                         "
Expert en Développement et Maintenance,3 novembre 2023,loc:             Bizerte Nord,"['D', 'é', 't', 'a', 'i', 'l', 's', 'd', 'e', 'l', 'a', 'n', 'n', 'o', 'n', 'c', 'e', 'R', 'é', 'f', 'é', 'r', 'e', 'n', 'c', 'e', '1', '9', '0', '1', '4', '8', 'P', 'u', 'b', 'l', 'i', 'é', 'e', 'l', 'e', '3', 'n', 'o', 'v', 'e', 'm', 'b', 'r', 'e', '2', '0', '2', '3', 'T', 'y', 'p', 'e', 'd', 'e', 'p', 'o', 's', 't', 'e', 'C', 'D', 'I', 'C', 'D', 'D', 'S', 'I', 'V', 'P', 'L', 'i', 'e', 'u', 'd', 'e', 't', 'r', 'a', 'v', 'a', 'i', 'l', 'B', 'i', 'z', 'e', 'r', 't', 'e', 'N', 'o', 'r', 'd', 'B', 'i', 'z', 'e', 'r', 't', 'e', 'T', 'u', 'n', 'i', 's', 'i', 'e', 'E', 'x', 'p', 'é', 'r', 'i', 'e', 'n', 'c', 'e', 'A', 'u', 'c', 'u', 'n', 'e', 'e', 'x', 'p', 'é', 'r', 'i', 'e', 'n', 'c', 'e', 'É', 't', 'u', 'd', 'e', 'B', 'a', 'c', '3', 'R', 'é', 'm', 'u', 'n', 'é', 'r', 'a', 't', 'i', 'o', 'n', 'p', 'r', 'o', 'p', 'o', 's', 'é', 'e', '8', '0', '0', '1', '5', '0', '0', 'D', 'T', 'M', 'o', 'i', 's', 'D', 'i', 's', 'p', 'o', 'n', 'i', 'b', 'i', 'l', 'i', 't', 'é', 'P', 'l', 'e', 'i', 'n', 't', 'e', 'm', 'p', 's']",[],O Z O N E  ," Description de l'annonce: Nous sommes à la recherche d'un professionnel qualifié pour rejoindre notre équipe en tant que spécialiste du développement et de la maintenance des solutions PL/SQL, avec une expertise approfondie en SQL avancé. Les principales responsabilités incluent le développement continu, la maintenance proactive des solutions PL/SQL, ainsi que la gestion des sauvegardes et des backups SQL.Le candidat idéal devrait démontrer une solide compréhension des serveurs, associée à une maîtrise des langages de développement, de préférence dans un environnement desktop. La compétence dans un ou plusieurs langages tels que VB6 ou C# est fortement appréciée.De plus, le candidat recherché habite idéalement à Bizerte centre, renforçant ainsi notre engagement envers une équipe locale dynamique.Si vous êtes passionné par le développement SQL, la maintenance de solutions robustes et que vous possédez une expertise avancée en SQL, nous vous invitons à postuler et à contribuer à notre équipe dynamique.                         "
TechLeader CyberSécurité,3 novembre 2023,"loc:                     Tunis,                            Tunisie","['D', 'é', 't', 'a', 'i', 'l', 's', 'd', 'e', 'l', 'a', 'n', 'n', 'o', 'n', 'c', 'e', 'R', 'é', 'f', 'é', 'r', 'e', 'n', 'c', 'e', '1', '8', '9', '1', '8', '5', 'P', 'u', 'b', 'l', 'i', 'é', 'e', 'l', 'e', '3', 'n', 'o', 'v', 'e', 'm', 'b', 'r', 'e', '2', '0', '2', '3', 'L', 'i', 'e', 'u', 'd', 'e', 't', 'r', 'a', 'v', 'a', 'i', 'l', 'T', 'u', 'n', 'i', 's', 'T', 'u', 'n', 'i', 's', 'i', 'e', 'E', 'x', 'p', 'é', 'r', 'i', 'e', 'n', 'c', 'e', 'E', 'n', 't', 'r', 'e', '5', 'e', 't', '1', '0', 'a', 'n', 's', 'É', 't', 'u', 'd', 'e', 'B', 'a', 'c', '5', 'D', 'i', 's', 'p', 'o', 'n', 'i', 'b', 'i', 'l', 'i', 't', 'é', 'P', 'l', 'e', 'i', 'n', 't', 'e', 'm', 'p', 's', 'L', 'a', 'n', 'g', 'u', 'e', 's', 'F', 'r', 'a', 'n', 'ç', 'a', 'i', 's', 'A', 'n', 'g', 'l', 'a', 'i', 's']","['-Français,Anglais-']",B I N I T N S," Description de l'annonce: Binit Nearshore Services (BinitNS) est une société de Conseil et de Services opérant dans le domaine de l’ITO et du BPO. Nous conseillons nos clients Européens sur leur Stratégie IT dans le domaine de l’Infrastructure, de la Cybersécurité et du développement/choix des solutions métiers. Nous les accompagnons aussi dans le cadre de leur installation en Tunisie et le recrutement de leurs équipes nearshore en extension de leurs équipes européennes.Dans ce cadre, BinitNS monte un centre de compétences dans le domaine de la Cybersécurité pour conseiller nos clients et leur rendre des services sur 3 axes:1. Évaluation - Recommandations:• Évaluation de la maturité Cybersécurité au niveau de l’entreprise• Exécution des Tests d’intrusion (Web, Postes clients, Infra Cloud et/ou Datacenter, Mobile)• Revues des configurations, du code, en vue de s’assurer du respect des règle de Cybersécurité• Revues des politiques des Plan de Continuité d’Activité• Établissement des Feuilles de route court et moyen terme2. Mise en Œuvredes Feuilles de route Cybersécurité:• Levée des vulnérabilités détectées à court terme• Préparation de l’entreprise à la Certification ISO 27001• Supervision du processus de Certification ISO 27001• Mise en place du système de management de la Sécurité du SI• Choix et implémentation des solutions Cybersécurité (SOC/Data Protection, ISMS, etc.).• Tableaux de bords et Reporting Cybersécurité• Être l'Interlocuteur technique des auditeurs du client (Audit de sécurité informatique, Audit réglementaire)• Supervision de la mise en place de la partie IT des plans d'action après les audits3. Services Managés:• Réponses à incidents, investigations• Formation & Sensibilisation Cybersécurité• Veille continue sur les sujets de Cybersécurité• Collecte des informations en continu à partir de diverses sources de l’infrastructure des clients (serveurs, applications, périphériques réseau, etc.).• Détermination en permanence du niveau de risque du trafic réseau et détection des anomalies• Surveillance et analyse en permanence de l'utilisation des terminaux pour détecter les comportements déviants de l'utilisateur, des processus ou des logiciels disponibles• Fourniture le cas échéant d’un service SOC où les alertes de sécurité font l'objet d'une enquête et où seuls les incidents vérifiés sont signalés et escaladésNous recrutons, dans un premier temps une équipe d’ingénieurs spécialisés dans le domaine de la CyberSécurité composée d’un Consultant Senior Cybersécurité, d’un Leader Technique Infrastructure et d’un Ingénieur Système Admin spécialisé.Cette annonce concerne le Leader Technique. Nous serions heureux de travailler avec vous :• Si vous avez 5 à 8 ans d’expérience dans le domaine de la gestion d’Infrastructure Système (datacenters privés et cloud) , réseaux et postes de travail• Si vous avez une expérience d’au moins deux ans sur une (ou des) infrastructure(s) qui ont fait l’objet d’audits Cybersécurité• Si vous avez participé à des PCA (Plans de Conduite d’Activité) avec des tests de PRA (Plan de Reprise d’Activité)• Si vous maîtrisez les langues anglaises et françaises à l’oral et à l’écritSi vous remplissez ces conditions et que vous aimez travailler dans un environnement international, n’hésitez pas à partager avec nous votre CV.                         "
Consultant Senior CyberSécurité,3 novembre 2023,"loc:                     Tunis,                            Tunisie","['D', 'é', 't', 'a', 'i', 'l', 's', 'd', 'e', 'l', 'a', 'n', 'n', 'o', 'n', 'c', 'e', 'R', 'é', 'f', 'é', 'r', 'e', 'n', 'c', 'e', '1', '8', '9', '1', '7', '7', 'P', 'u', 'b', 'l', 'i', 'é', 'e', 'l', 'e', '3', 'n', 'o', 'v', 'e', 'm', 'b', 'r', 'e', '2', '0', '2', '3', 'L', 'i', 'e', 'u', 'd', 'e', 't', 'r', 'a', 'v', 'a', 'i', 'l', 'T', 'u', 'n', 'i', 's', 'T', 'u', 'n', 'i', 's', 'i', 'e', 'E', 'x', 'p', 'é', 'r', 'i', 'e', 'n', 'c', 'e', 'E', 'n', 't', 'r', 'e', '5', 'e', 't', '1', '0', 'a', 'n', 's', 'É', 't', 'u', 'd', 'e', 'B', 'a', 'c', '5', 'D', 'i', 's', 'p', 'o', 'n', 'i', 'b', 'i', 'l', 'i', 't', 'é', 'P', 'l', 'e', 'i', 'n', 't', 'e', 'm', 'p', 's', 'L', 'a', 'n', 'g', 'u', 'e', 's', 'F', 'r', 'a', 'n', 'ç', 'a', 'i', 's', 'A', 'n', 'g', 'l', 'a', 'i', 's']","['-Français,Anglais-']",B I N I T N S," Description de l'annonce: Binit Nearshore Services (BinitNS) est une société de Conseil et de Services opérant dans le domaine de l’ITO et du BPO. Nous conseillons nos clients Européens sur leur Stratégie IT dans le domaine de l’Infrastructure, de la Cybersécurité et du développement/choix des solutions métiers. Nous les accompagnons aussi dans le cadre de leur installation en Tunisie et le recrutement de leurs équipes nearshore en extension de leurs équipes européennes.Dans ce cadre, BinitNS monte un centre de compétences dans le domaine de la Cybersécurité pour conseiller nos clients et leur rendre des services sur 3 axes:1. Évaluation - Recommandations:• Évaluation de la maturité Cybersécurité au niveau de l’entreprise• Exécution des Tests d’intrusion (Web, Postes clients, Infra Cloud et/ou Datacenter, Mobile)• Revues des configurations, du code, en vue de s’assurer du respect des règle de Cybersécurité• Revues des politiques des Plan de Continuité d’Activité• Établissement des Feuilles de route court et moyen terme2. Mise en Œuvredes Feuilles de route Cybersécurité:• Levée des vulnérabilités détectées à court terme• Préparation de l’entreprise à la Certification ISO 27001• Supervision du processus de Certification ISO 27001• Mise en place du système de management de la Sécurité du SI• Choix et implémentation des solutions Cybersécurité (SOC/Data Protection, ISMS, etc.).• Tableaux de bords et Reporting Cybersécurité• Être l'Interlocuteur technique des auditeurs du client (Audit de sécurité informatique, Audit réglementaire)• Supervision de la mise en place de la partie IT des plans d'action après les audits3. Services Managés:• Réponses à incidents, investigations• Formation & Sensibilisation Cybersécurité• Veille continue sur les sujets de Cybersécurité• Collecte des informations en continu à partir de diverses sources de l’infrastructure des clients (serveurs, applications, périphériques réseau, etc.).• Détermination en permanence du niveau de risque du trafic réseau et détection des anomalies• Surveillance et analyse en permanence de l'utilisation des terminaux pour détecter les comportements déviants de l'utilisateur, des processus ou des logiciels disponibles• Fourniture le cas échéant d’un service SOC où les alertes de sécurité font l'objet d'une enquête et où seuls les incidents vérifiés sont signalés et escaladésNous recrutons, dans un premier temps une équipe d’ingénieurs spécialisés dans le domaine de la CyberSécurité composée d’un Consultant Senior Cybersécurité, d’un Leader Technique Infrastructure et d’un Ingénieur Système Admin spécialisé.Cette annonce concerne le Consultant Senior. Nous serions heureux de travailler avec vous :• Si vous avez 7 à 10 ans d’expérience, dont au minimum 4 dans le domaine de le Cybersécurité (ayant conduit des audits, mis en place une politique de Cybersécurité, etc.).• Si vous avez une compétence prouvée de gestionnaire de projets conséquents dans le domaine de l’infrastructure et de la Cybersécurité, y compris la partie organisationnelle• Si vous avez des connaissances des processus métiers. La connaissance des secteurs financiers et de l’assurance, serait un plus.• Si vous maîtrisez parfaitement les langues anglaises et françaises à l’oral et à l’écritSi vous remplissez ces conditions et que vous aimez travailler dans un environnement international, n’hésitez pas à partager avec nous votre CV.                         "
Chief Digital Officer (CDO),3 novembre 2023,"loc:                     Tunis,                            Tunisie","['D', 'é', 't', 'a', 'i', 'l', 's', 'd', 'e', 'l', 'a', 'n', 'n', 'o', 'n', 'c', 'e', 'R', 'é', 'f', 'é', 'r', 'e', 'n', 'c', 'e', '1', '8', '9', '1', '9', '2', 'P', 'u', 'b', 'l', 'i', 'é', 'e', 'l', 'e', '3', 'n', 'o', 'v', 'e', 'm', 'b', 'r', 'e', '2', '0', '2', '3', 'L', 'i', 'e', 'u', 'd', 'e', 't', 'r', 'a', 'v', 'a', 'i', 'l', 'T', 'u', 'n', 'i', 's', 'T', 'u', 'n', 'i', 's', 'i', 'e', 'E', 'x', 'p', 'é', 'r', 'i', 'e', 'n', 'c', 'e', 'P', 'l', 'u', 's', 'q', 'u', 'e', '1', '0', 'a', 'n', 's', 'É', 't', 'u', 'd', 'e', 'B', 'a', 'c', '5', 'D', 'i', 's', 'p', 'o', 'n', 'i', 'b', 'i', 'l', 'i', 't', 'é', 'P', 'l', 'e', 'i', 'n', 't', 'e', 'm', 'p', 's', 'L', 'a', 'n', 'g', 'u', 'e', 's', 'F', 'r', 'a', 'n', 'ç', 'a', 'i', 's', 'A', 'n', 'g', 'l', 'a', 'i', 's']","['-Français,Anglais-']",B I N I T N S," Description de l'annonce: Binit Nearshore Services (BinitNS) est une société de Conseil et de Services opérant dans le domaine de l’ITO et du BPO. Nous conseillons et nous accompagnons nos clients Européens dans le cadre de l’installation en Tunisie de leurs équipes nearshore en extension de leurs équipes européennes.Un de nos clients européens, pionnier et leader français des courtiers en prêts immobiliers, a des équipes de développement et des équipes Infrastructure opérant chez nous, en prolongement de ses équipes Produits, Architecture, développement et support en France.Dans ce cadre, nous cherchons à recruter un Chief Digital Officer pour manager ces équipes et qui aura les responsabilités suivantes:1.Applications:• Construire avec les PO (maîtrise d’ouvrage) et les métiers la Roadmap projets et livraison avec un objectif de digitalisation optimale des processus du consommateur au bailleur de fonds en passant par le mandataire et le back office• Suivre et supporter techniquement et sur le plan de la méthodologie les équipes spécialisées de développement par domaine: CRM central, autres logiciels métiers, portail et développements web, etc.• Suivre les équipes PO et QA de test et assurer la bonne coordination avec les équipes de Développement• Améliorer en permanence les performances des équipes qualitativementL’environnement technique: PHP/Symphony, React, Ionic, Angular, C#, .Net, SQL Server, MsDynamics2.Support et infrastructure• Construire des processus de support efficaces et les améliorer en permanence, en les rendant digitaux et avec contrainte minimale sécuritaire pour les utilisateurs• Mettre en place les bons KPI pour mesurer la progression de la qualité de service (volumes de tickets, délais de traitement, délais d’onboarding des nouveaux arrivants, enquêtes de satisfaction clients)• Assurer une politique pérenne de l’infrastructure avec une gestion rigoureuse des coûts• Préparer puis mettre en place une certification ISO 27001 puis un Security Operation Center», SOC, permettant une gestion performante des risques liés à la Cybersécurité.L’environnement Technique: Windows OS, O365, Azure, SQL Servers, FortinetSi un tel challenge vous intéresse et que vous avez 10 ans d’expérience professionnelle cumulant de la gestion de l’infrastructure et des équipes de développement et QA et que vous êtes motivé pour travailler à Tunis dans un environnement international, nous serions heureux de vous voir nous rejoindre.Rémunération attractive.Date de début: Au plus tôtNous vous prions de bien vouloir nous faire parvenir votre CV et quelques motsen évoquant la référenceCDO-CFP.                         "
CyberSecurity Operations Administrator,2 novembre 2023,"loc:                     Tunis,                            Tunisie","['D', 'é', 't', 'a', 'i', 'l', 's', 'd', 'e', 'l', 'a', 'n', 'n', 'o', 'n', 'c', 'e', 'R', 'é', 'f', 'é', 'r', 'e', 'n', 'c', 'e', '1', '9', '0', '0', '8', '5', 'P', 'u', 'b', 'l', 'i', 'é', 'e', 'l', 'e', '2', 'n', 'o', 'v', 'e', 'm', 'b', 'r', 'e', '2', '0', '2', '3', 'T', 'y', 'p', 'e', 'd', 'e', 'p', 'o', 's', 't', 'e', 'C', 'D', 'I', 'L', 'i', 'e', 'u', 'd', 'e', 't', 'r', 'a', 'v', 'a', 'i', 'l', 'T', 'u', 'n', 'i', 's', 'T', 'u', 'n', 'i', 's', 'i', 'e', 'E', 'x', 'p', 'é', 'r', 'i', 'e', 'n', 'c', 'e', 'E', 'n', 't', 'r', 'e', '2', 'e', 't', '5', 'a', 'n', 's', 'É', 't', 'u', 'd', 'e', 'B', 'a', 'c', '5', 'D', 'i', 's', 'p', 'o', 'n', 'i', 'b', 'i', 'l', 'i', 't', 'é', 'P', 'l', 'e', 'i', 'n', 't', 'e', 'm', 'p', 's', 'L', 'a', 'n', 'g', 'u', 'e', 's', 'F', 'r', 'a', 'n', 'ç', 'a', 'i', 's', 'A', 'n', 'g', 'l', 'a', 'i', 's']","['-Français,Anglais-']",F A U R E C I A   I N F O R M A T I Q U E   T U N I S I E   -   F I T," Description de l'annonce: Our ITDivision (Group Information Systems)is looking for his/herCyberSecurity Operations Administratorfor endpoint protection.Ready for challenges that matter?The role of the CyberSecurity Operations Administrator is to perform cybersecurity tasks on a worldwide perimeter. He/She shall provide support to the cybersecurity operations leader on specific cybersecurity systems & applications and work in close cooperation with him.The main missions of the role are to :Assist with the management of the entire landscape of the cybersecurity infrastructure of the company focusing on endpoint protection domains (DLP, Encryption, AV & EDR, …)Ensure the lifecycle solution (from implementation to changes, and monitoring)Troubleshooting, investigation, debugging of any issueProvide assistance / expertise to Level 1 (Helpdesk & Monitoring teams and local IT at the sites)Provide Level 3 support (Competence Center) for cybersecurity solutionsDocumenting procedures and processes related to operation of CyberSecurity solutionsUpdating all relevant documentation related to the protection of the Information Systems (inventories, classifications, etc.)Suggesting changes aiming at optimizing the operation of CyberSecurity solutionContributing to the evaluation, architecture, and selection of CyberSecurity solutions, the definition of hardware and software standardsand if you were the one !The ideal candidate will be/have:ExperienceKnowledge in cybersecurity focused on endpointHands on knowledge on AV/EDR solutionKnowledge in OS (windows/linux)Knowledge in installation/configuration/operation of Linux systemsKnowledge in automation / scriptingSkills and competenciesCuriousPassionate for cyberHighly developed skills in problem solving and investigation of cybersecurity issuesNatural motivation to integrate multidisciplany international IT teamsPragmatic problem solving approach while respecting Faurecia standardsactic abilities requiredWell developed communication skillsWorking in teamsService orientedGood level of English mandatory                         "
Opérateur de Saisie,2 novembre 2023,loc:             La Marsa,"['D', 'é', 't', 'a', 'i', 'l', 's', 'd', 'e', 'l', 'a', 'n', 'n', 'o', 'n', 'c', 'e', 'R', 'é', 'f', 'é', 'r', 'e', 'n', 'c', 'e', '1', '9', '0', '0', '6', '0', 'P', 'u', 'b', 'l', 'i', 'é', 'e', 'l', 'e', '2', 'n', 'o', 'v', 'e', 'm', 'b', 'r', 'e', '2', '0', '2', '3', 'T', 'y', 'p', 'e', 'd', 'e', 'p', 'o', 's', 't', 'e', 'C', 'D', 'I', 'C', 'D', 'D', 'S', 'I', 'V', 'P', 'L', 'i', 'e', 'u', 'd', 'e', 't', 'r', 'a', 'v', 'a', 'i', 'l', 'L', 'a', 'M', 'a', 'r', 's', 'a', 'T', 'u', 'n', 'i', 's', 'T', 'u', 'n', 'i', 's', 'i', 'e', 'E', 'x', 'p', 'é', 'r', 'i', 'e', 'n', 'c', 'e', 'A', 'u', 'c', 'u', 'n', 'e', 'e', 'x', 'p', 'é', 'r', 'i', 'e', 'n', 'c', 'e', 'É', 't', 'u', 'd', 'e', 'F', 'o', 'r', 'm', 'a', 't', 'i', 'o', 'n', 's', 'p', 'r', 'o', 'f', 'e', 's', 's', 'i', 'o', 'n', 'n', 'e', 'l', 'l', 'e', 's', 'R', 'é', 'm', 'u', 'n', 'é', 'r', 'a', 't', 'i', 'o', 'n', 'p', 'r', 'o', 'p', 'o', 's', 'é', 'e', '5', '0', '0', '6', '0', '0', 'D', 'T', 'M', 'o', 'i', 's', 'D', 'i', 's', 'p', 'o', 'n', 'i', 'b', 'i', 'l', 'i', 't', 'é', 'P', 'l', 'e', 'i', 'n', 't', 'e', 'm', 'p', 's', 'L', 'a', 'n', 'g', 'u', 'e', 's', 'F', 'r', 'a', 'n', 'ç', 'a', 'i', 's']",[],," Description de l'annonce: Nous recherchons un opérateur de saisie pour rejoindre notre équipe, vous serez chargé de collecter, vérifier et entrer des données précises dans nos systèmes informatiques.Responsabilités:- Saisie de données à partir de documents électroniques.- Vérification de l'exactitude des informations saisies.- Respect des normes de qualité et des délais de traitement.- Gestion de fichiers de données.Avantages :- Environnement de travail dynamique.- Possibilité de développer des compétences en gestion de données.Exigences:- Excellente précision et attention aux détails.- Bonnes compétences en informatique, y compris la maîtrise des logiciels de traitement de texte et de tableur.- Capacité à travailler de manière autonome.- Capacité à respecter les délais.Solides compétences en français à l'écrit et à l'oral.                         "
Développeur FULLSTACK,2 novembre 2023,"loc:             Nabeul,                            Nabeul","['D', 'é', 't', 'a', 'i', 'l', 's', 'd', 'e', 'l', 'a', 'n', 'n', 'o', 'n', 'c', 'e', 'R', 'é', 'f', 'é', 'r', 'e', 'n', 'c', 'e', '1', '9', '0', '0', '1', '2', 'P', 'u', 'b', 'l', 'i', 'é', 'e', 'l', 'e', '2', 'n', 'o', 'v', 'e', 'm', 'b', 'r', 'e', '2', '0', '2', '3', 'T', 'y', 'p', 'e', 'd', 'e', 'p', 'o', 's', 't', 'e', 'C', 'D', 'I', 'C', 'D', 'D', 'S', 'I', 'V', 'P', 'L', 'i', 'e', 'u', 'd', 'e', 't', 'r', 'a', 'v', 'a', 'i', 'l', 'N', 'a', 'b', 'e', 'u', 'l', 'N', 'a', 'b', 'e', 'u', 'l', 'T', 'u', 'n', 'i', 's', 'i', 'e', 'E', 'x', 'p', 'é', 'r', 'i', 'e', 'n', 'c', 'e', 'M', 'o', 'i', 'n', 's', 'd', 'u', 'n', 'a', 'n', 'É', 't', 'u', 'd', 'e', 'B', 'a', 'c', '3', 'R', 'é', 'm', 'u', 'n', 'é', 'r', 'a', 't', 'i', 'o', 'n', 'p', 'r', 'o', 'p', 'o', 's', 'é', 'e', '7', '5', '0', 'D', 'T', 'M', 'o', 'i', 's', 'D', 'i', 's', 'p', 'o', 'n', 'i', 'b', 'i', 'l', 'i', 't', 'é', 'P', 'l', 'e', 'i', 'n', 't', 'e', 'm', 'p', 's', 'L', 'a', 'n', 'g', 'u', 'e', 's', 'A', 'r', 'a', 'b', 'e', 'F', 'r', 'a', 'n', 'ç', 'a', 'i', 's', 'A', 'n', 'g', 'l', 'a', 'i', 's']","['-Arabe,Français,Anglais-']",3 W W I T," Description de l'annonce: 3W WIT est une agence web spécialisée dans la mise en place de solutions sur-mesure basé à Nabeul.Afin de renforcer notre équipe, nous somme à la recherche desdéveloppeurs web Full-Stack.Débutants acceptés bac+3 ou plus, poste en plein temps à Nabeul ( Pas de freelance ou télétravail ).On cherche des profils motivés, sérieux capable d'évoluer et intégrer une équipe très technique. De notre coté on vous donnerai l'opportunité de:- Avoir un cadre de travail idéale très stable,- Ingérer une équipe jeune et dynamique,- Avoir un haut niveau de suivi et d'encadrement,- Avoir la chance de travailler à un échelle international sur des projets de haut niveau technique- Avoir un salaire attractif avec un réel plans de carrière.Le candidat doit avoir impérativement:- Un bon niveau de réflexion algorithmique vu la nature du travail qui sera demandé par la suite.- Un bon niveau en Français et Anglais- Un esprit de travail en équipeIl serai préférable mais pas obligatoire d'avoir:- Une expérience de développement à base des framework PHP Symfony, Laravel, Cake PHP- Une expérience en développement frontend NodeJS, VueJS- une maitrise des CMS Wordpress, PrestaShop ou Shopify- Une expérience significatif coté frontend : JS/JQuery/AJAX- Une expérience significatif en intégration HTML/CSS responsive- Une maitrise de Bootstrap et son système de Grid                         "
